[
  {
    "id": "secondhand-trade",
    "title": "중고거래 사기 안심 체크",
    "subtitle": "안전결제 사칭·선입금·시세 이하·외부 링크",
    "category": "scam",
    "estimatedTime": "30초~1분",
    "introCopy": "거래 상대를 의심하라는 뜻이 아닙니다. 결제 방식, 선입금 요구, 외부 링크, 시세 차이를 확인해 사기 피해를 줄이는 체크입니다.",
    "disclaimer": "이 체크는 법적 판단, 의료·심리 진단, 범죄 예측이 아닙니다. 긴급 위험이 있으면 112, 119 등 공식 도움을 먼저 이용하세요.",
    "questions": [
      { "id": "st1", "text": "시세보다 비정상적으로 싼 매물인가요?", "helpText": "지나치게 싼 가격은 미끼일 수 있습니다.", "category": "price", "weight": 1, "options": [ { "label": "예", "value": "yes", "score": 2 }, { "label": "아니오", "value": "no", "score": 0 }, { "label": "모르겠어요", "value": "unknown", "score": 1 } ] },
      { "id": "st2", "text": "직거래 대신 선입금(택배 거래)을 강하게 요구하나요?", "helpText": "선입금만 고집한다면 한 번 멈춰볼 신호입니다.", "category": "payment", "weight": 1, "options": [ { "label": "예", "value": "yes", "score": 2 }, { "label": "아니오", "value": "no", "score": 0 }, { "label": "모르겠어요", "value": "unknown", "score": 1 } ] },
      { "id": "st3", "text": "문자·메신저 등 외부 링크로 결제를 유도하나요?", "helpText": "외부 링크 결제는 사기 위험이 높습니다.", "category": "link", "weight": 1, "options": [ { "label": "예", "value": "yes", "score": 2 }, { "label": "아니오", "value": "no", "score": 0 }, { "label": "모르겠어요", "value": "unknown", "score": 1 } ] },
      { "id": "st4", "text": "상대가 직접 보낸 안전결제 링크를 쓰라고 하나요?", "helpText": "안전결제는 플랫폼 공식 기능으로만 이용하세요.", "category": "link", "weight": 1, "options": [ { "label": "예", "value": "yes", "score": 2 }, { "label": "아니오", "value": "no", "score": 0 }, { "label": "모르겠어요", "value": "unknown", "score": 1 } ] },
      { "id": "st5", "text": "가격을 깎아줄 테니 즉시 입금하라고 재촉하나요?", "helpText": "재촉은 판단을 흐리게 만드는 흔한 수법입니다.", "category": "pressure", "weight": 1, "options": [ { "label": "예", "value": "yes", "score": 2 }, { "label": "아니오", "value": "no", "score": 0 }, { "label": "모르겠어요", "value": "unknown", "score": 1 } ] },
      { "id": "st6", "text": "플랫폼 채팅 밖 개인 연락처로 대화를 옮기자고 하나요?", "helpText": "기록이 남지 않는 곳으로 옮기려는지 확인하세요.", "category": "channel", "weight": 1, "options": [ { "label": "예", "value": "yes", "score": 2 }, { "label": "아니오", "value": "no", "score": 0 }, { "label": "모르겠어요", "value": "unknown", "score": 1 } ] },
      { "id": "st7", "text": "입금 계좌가 매물 명의와 다르거나 의심스럽나요?", "helpText": "명의 불일치 계좌는 위험 신호입니다.", "category": "account", "weight": 1, "options": [ { "label": "예", "value": "yes", "score": 2 }, { "label": "아니오", "value": "no", "score": 0 }, { "label": "모르겠어요", "value": "unknown", "score": 1 } ] },
      { "id": "st8", "text": "추가 수수료·보증금·인증비를 입금하라고 하나요?", "helpText": "정상 거래에는 없는 추가 입금 요구입니다.", "category": "money", "weight": 1, "options": [ { "label": "예", "value": "yes", "score": 2 }, { "label": "아니오", "value": "no", "score": 0 }, { "label": "모르겠어요", "value": "unknown", "score": 1 } ] },
      { "id": "st9", "text": "실물 사진·영상 요청을 회피하나요?", "helpText": "실물 확인을 피한다면 신중해야 합니다.", "category": "verify", "weight": 1, "options": [ { "label": "예", "value": "yes", "score": 2 }, { "label": "아니오", "value": "no", "score": 0 }, { "label": "모르겠어요", "value": "unknown", "score": 1 } ] },
      { "id": "st10", "text": "계좌·연락처 사기 이력 조회를 아직 안 해봤나요?", "helpText": "입금 전 사기 이력 조회는 기본 안전 루틴입니다.", "category": "check", "weight": 1, "options": [ { "label": "예", "value": "yes", "score": 2 }, { "label": "아니오", "value": "no", "score": 0 }, { "label": "모르겠어요", "value": "unknown", "score": 1 } ] }
    ],
    "resultLevels": [
      { "minScore": 0, "maxScore": 5, "label": "낮음", "tone": "safe", "summary": "지금은 기본 확인만 해도 괜찮아 보여요. 그래도 결제·계좌·링크는 공식 경로로 한 번 더 확인하세요." },
      { "minScore": 6, "maxScore": 10, "label": "주의", "tone": "notice", "summary": "몇 가지 신호가 있어요. 입금 전에 한 번 멈춰 확인해보세요." },
      { "minScore": 11, "maxScore": 15, "label": "경계", "tone": "caution", "summary": "지금은 입금과 추가 정보 제공을 멈추고 기록과 확인이 필요합니다." },
      { "minScore": 16, "maxScore": 30, "label": "위험 가능성 높음", "tone": "danger", "summary": "즉시 입금을 멈추고 공식기관 또는 신뢰할 수 있는 사람에게 확인·신고하세요." }
    ],
    "recommendedActions": [
      "플랫폼 공식 안전결제만 사용하기",
      "입금 전 사기 이력 조회(계좌·연락처) 해보기",
      "외부 링크 결제 누르지 않기",
      "거래 대화·계좌·연락처 캡처해두기",
      "피해 의심 시 112 또는 1332에 확인하기"
    ],
    "shareTemplates": [
      "입금 전 30초 거래 안심 체크 완료 ✅",
      "싼 매물일수록 공식 안전결제부터.",
      "중고거래하는 친구에게 보내는 체크.",
      "외부 링크 결제는 누르지 않기.",
      "입금 전 계좌 조회는 기본."
    ],
    "copyMessages": [
      "플랫폼 공식 안전결제로만 진행할게요.",
      "외부 링크 결제는 사용하지 않겠습니다.",
      "입금 전에 계좌와 연락처를 먼저 확인하겠습니다."
    ],
    "officialResources": [
      { "label": "긴급 위험", "value": "112 경찰 / 119 응급" },
      { "label": "금융사기·지급정지 상담", "value": "1332 금융감독원" },
      { "label": "사이버범죄 신고", "value": "112 / 경찰청 사이버수사" }
    ]
  },
  {
    "id": "qr-phishing",
    "title": "QR코드·큐싱 피싱 체크",
    "subtitle": "주차·과태료·배송 QR, 가짜 앱 설치, 결제 유도",
    "category": "phishing",
    "estimatedTime": "30초~1분",
    "introCopy": "낯선 QR을 무조건 피하라는 뜻이 아닙니다. 출처, 앱 설치 요구, 로그인·결제 유도를 확인해 큐싱 피해를 줄이는 체크입니다.",
    "disclaimer": "이 체크는 법적 판단, 의료·심리 진단, 범죄 예측이 아닙니다. 긴급 위험이 있으면 112, 119 등 공식 도움을 먼저 이용하세요.",
    "questions": [
      { "id": "qr1", "text": "출처가 불분명한 QR(전단·문자·이메일·길거리 스티커)인가요?", "helpText": "출처가 확인되지 않는 QR은 신중히 다루세요.", "category": "source", "weight": 1, "options": [ { "label": "예", "value": "yes", "score": 2 }, { "label": "아니오", "value": "no", "score": 0 }, { "label": "모르겠어요", "value": "unknown", "score": 1 } ] },
      { "id": "qr2", "text": "QR을 찍자 앱 설치나 파일 다운로드를 요구하나요?", "helpText": "출처 불명 앱 설치는 멈추는 편이 안전합니다.", "category": "install", "weight": 1, "options": [ { "label": "예", "value": "yes", "score": 2 }, { "label": "아니오", "value": "no", "score": 0 }, { "label": "모르겠어요", "value": "unknown", "score": 1 } ] },
      { "id": "qr3", "text": "기존 안내문 위에 덧붙여진 QR 스티커처럼 보이나요?", "helpText": "위에 덧붙인 스티커는 변조 가능성이 있습니다.", "category": "source", "weight": 1, "options": [ { "label": "예", "value": "yes", "score": 2 }, { "label": "아니오", "value": "no", "score": 0 }, { "label": "모르겠어요", "value": "unknown", "score": 1 } ] },
      { "id": "qr4", "text": "연결된 주소가 공식 도메인과 달라 보이나요?", "helpText": "주소 철자나 도메인이 미묘하게 다른지 확인하세요.", "category": "url", "weight": 1, "options": [ { "label": "예", "value": "yes", "score": 2 }, { "label": "아니오", "value": "no", "score": 0 }, { "label": "모르겠어요", "value": "unknown", "score": 1 } ] },
      { "id": "qr5", "text": "접속 후 계정 로그인·인증번호 입력을 요구하나요?", "helpText": "인증번호는 누구에게도 입력·전달하지 마세요.", "category": "credential", "weight": 1, "options": [ { "label": "예", "value": "yes", "score": 2 }, { "label": "아니오", "value": "no", "score": 0 }, { "label": "모르겠어요", "value": "unknown", "score": 1 } ] },
      { "id": "qr6", "text": "주차요금·과태료·범칙금을 QR로 즉시 결제하라고 하나요?", "helpText": "공식 납부처인지 직접 확인하세요.", "category": "payment", "weight": 1, "options": [ { "label": "예", "value": "yes", "score": 2 }, { "label": "아니오", "value": "no", "score": 0 }, { "label": "모르겠어요", "value": "unknown", "score": 1 } ] },
      { "id": "qr7", "text": "택배·배송 조회를 QR로 하라며 개인정보를 묻나요?", "helpText": "배송 조회에 과한 개인정보는 필요하지 않습니다.", "category": "delivery", "weight": 1, "options": [ { "label": "예", "value": "yes", "score": 2 }, { "label": "아니오", "value": "no", "score": 0 }, { "label": "모르겠어요", "value": "unknown", "score": 1 } ] },
      { "id": "qr8", "text": "결제·송금을 서두르라고 재촉하나요?", "helpText": "재촉은 판단을 흐리게 만드는 흔한 수법입니다.", "category": "pressure", "weight": 1, "options": [ { "label": "예", "value": "yes", "score": 2 }, { "label": "아니오", "value": "no", "score": 0 }, { "label": "모르겠어요", "value": "unknown", "score": 1 } ] },
      { "id": "qr9", "text": "접속 화면이 진짜 기관·은행과 미묘하게 다른가요?", "helpText": "로고·문구·주소가 어색하면 의심하세요.", "category": "spoof", "weight": 1, "options": [ { "label": "예", "value": "yes", "score": 2 }, { "label": "아니오", "value": "no", "score": 0 }, { "label": "모르겠어요", "value": "unknown", "score": 1 } ] },
      { "id": "qr10", "text": "기관에 직접 확인하지 않고 QR만 보고 진행하려 하나요?", "helpText": "공식 앱·홈페이지·고객센터로 직접 확인하세요.", "category": "verify", "weight": 1, "options": [ { "label": "예", "value": "yes", "score": 2 }, { "label": "아니오", "value": "no", "score": 0 }, { "label": "모르겠어요", "value": "unknown", "score": 1 } ] }
    ],
    "resultLevels": [
      { "minScore": 0, "maxScore": 5, "label": "낮음", "tone": "safe", "summary": "지금은 기본 확인만 해도 괜찮아 보여요. 그래도 설치·로그인·결제는 공식 경로로 한 번 더 확인하세요." },
      { "minScore": 6, "maxScore": 10, "label": "주의", "tone": "notice", "summary": "몇 가지 신호가 있어요. 진행 전에 한 번 멈춰 확인해보세요." },
      { "minScore": 11, "maxScore": 15, "label": "경계", "tone": "caution", "summary": "지금은 앱 설치, 로그인, 결제를 멈추고 기록과 확인이 필요합니다." },
      { "minScore": 16, "maxScore": 30, "label": "위험 가능성 높음", "tone": "danger", "summary": "즉시 설치·결제·입력을 멈추고 공식기관 또는 신뢰할 수 있는 사람에게 확인·신고하세요." }
    ],
    "recommendedActions": [
      "QR 대신 공식 앱·홈페이지·고객센터로 직접 접속하기",
      "QR로 유도된 앱 설치 멈추기",
      "로그인·인증번호·결제정보 입력하지 않기",
      "의심 문자·화면 캡처해두기",
      "피해 의심 시 118 또는 112에 확인하기"
    ],
    "shareTemplates": [
      "QR 찍기 전 30초 큐싱 안심 체크 ✅",
      "낯선 QR은 출처부터 확인.",
      "가족·지인에게 보내는 큐싱 체크.",
      "QR이 앱 설치를 요구하면 멈추기.",
      "인증번호는 절대 입력하지 않기."
    ],
    "copyMessages": [
      "이 QR은 공식 경로로 직접 확인한 뒤 진행하겠습니다.",
      "출처가 확인되지 않은 앱은 설치하지 않겠습니다.",
      "인증번호와 결제정보는 입력하지 않겠습니다."
    ],
    "officialResources": [
      { "label": "긴급 위험", "value": "112 경찰 / 119 응급" },
      { "label": "스미싱·해킹 상담", "value": "118 KISA" },
      { "label": "금융사기·지급정지 상담", "value": "1332 금융감독원" }
    ]
  }
]
